{
  "$schema": "http://json-schema.org/draft-07/schema#",
  "$id": "https://nova25/task-locks/registry.schema.json",
  "title": "NOVA 2.5 Task Registry",
  "description": "Derived projection of task state. NEVER edited directly. Generated by projection-builder from TASK_EVENTS.jsonl.",
  "type": "object",
  "required": ["schema_version", "engine_version", "generated_at", "event_count", "tasks"],
  "additionalProperties": false,
  "properties": {
    "schema_version": {
      "type": "integer",
      "description": "Schema version of this registry file. Increment on breaking changes.",
      "const": 1
    },
    "engine_version": {
      "type": "integer",
      "description": "Must match transitions.yaml engine_version. Mismatch = replay invalid.",
      "const": 1
    },
    "generated_at": {
      "type": "string",
      "format": "date-time",
      "description": "UTC timestamp of last projection rebuild."
    },
    "event_count": {
      "type": "integer",
      "minimum": 0,
      "description": "Number of events consumed to produce this projection. Used for consistency checks."
    },
    "tasks": {
      "type": "array",
      "items": { "$ref": "#/definitions/task_state" }
    }
  },
  "definitions": {
    "task_id": {
      "type": "string",
      "pattern": "^TASK-[0-9]{4,}(-[a-z])?$",
      "description": "Task ID. Forks use single lowercase suffix: TASK-0042-a. Nested suffixes are FORBIDDEN."
    },
    "task_state": {
      "type": "object",
      "required": ["task_id", "status"],
      "additionalProperties": false,
      "properties": {
        "task_id": { "$ref": "#/definitions/task_id" },
        "status": {
          "type": "string",
          "enum": [
            "TODO",
            "IN_PROGRESS",
            "REFACTOR_CLAIMED",
            "REVIEW_LOCKED",
            "APPROVED",
            "MERGED",
            "EXPIRED"
          ]
        },
        "implementation_lock": {
          "description": "Exclusive lock held by the implementation or refactor agent.",
          "oneOf": [
            { "type": "null" },
            { "$ref": "#/definitions/lock" }
          ]
        },
        "review_lock": {
          "description": "Exclusive lock held by the review or architect agent.",
          "oneOf": [
            { "type": "null" },
            { "$ref": "#/definitions/lock" }
          ]
        },
        "forked_from": {
          "description": "Parent task ID when this task is a fork of an EXPIRED task.",
          "oneOf": [
            { "type": "null" },
            { "$ref": "#/definitions/task_id" }
          ]
        },
        "fork_suffix": {
          "description": "Single lowercase letter suffix for this fork (a-z). Null for original tasks.",
          "oneOf": [
            { "type": "null" },
            {
              "type": "string",
              "pattern": "^[a-z]$"
            }
          ]
        },
        "pr_number": {
          "type": ["integer", "null"],
          "description": "GitHub PR number currently associated with this task."
        },
        "last_event_index": {
          "type": "integer",
          "minimum": 0,
          "description": "Index of the last TASK_EVENTS.jsonl event that changed this task's state."
        },
        "priority_weight": {
          "type": ["number", "null"],
          "description": "Set by TASK_PRIORITY_SET events. Null means default (1.0). Higher values schedule the task sooner."
        },
        "execution_cost": {
          "type": ["number", "null"],
          "description": "Set by TASK_PRIORITY_SET events. Null means default (1). Fibonacci scale: 1, 2, 3, 5, 8, 13, 21. Scheduler divides the score by this value."
        },
        "parent_idea": {
          "type": ["string", "null"],
          "pattern": "^I-[A-Z0-9]{4,}$",
          "description": "Idea that generated this task, when the task came from the Idea Factory layer."
        },
        "architecture_id": {
          "type": ["string", "null"],
          "pattern": "^ARCH-[A-Z0-9]{4,}$",
          "description": "Architecture artifact that generated this task."
        },
        "description": {
          "type": ["string", "null"],
          "description": "Generated task description."
        },
        "module": {
          "type": ["string", "null"],
          "description": "Architecture module this generated task belongs to."
        }
      }
    },
    "lock": {
      "type": "object",
      "required": ["agent", "model", "role", "claimed_at", "expires_at", "last_heartbeat"],
      "additionalProperties": false,
      "properties": {
        "agent": {
          "type": "string",
          "description": "Unique agent identifier (e.g. agent-copilot-impl-001)."
        },
        "model": {
          "type": "string",
          "description": "LLM model name (e.g. Claude 3.5 Sonnet, GPT-4 Turbo)."
        },
        "role": {
          "type": "string",
          "enum": ["IMPLEMENTATION", "REFACTOR", "REVIEW", "ARCHITECT"]
        },
        "branch": {
          "type": ["string", "null"],
          "description": "Feature branch name. Null for REVIEW/ARCHITECT roles."
        },
        "claimed_at": {
          "type": "string",
          "format": "date-time"
        },
        "expires_at": {
          "type": "string",
          "format": "date-time",
          "description": "Derived from claimed_at + TTL from transitions.yaml. Injected by projection builder."
        },
        "last_heartbeat": {
          "type": "string",
          "format": "date-time"
        }
      }
    }
  }
}
